{
    "title": "Senior Software Engineer",
    "summary": "Experienced full-stack developer with 5+ years building scalable web applications using React, Node.js, and cloud technologies. Passionate about clean code, user experience, and mentoring junior developers.",
    "experience": [
        {
            "role": "Senior Software Engineer",
            "organization": "TechCorp Inc.",
            "location": "San Francisco, CA",
            "startDate": "2021-03",
            "endDate": null,
            "bullets": [
                "Led development of microservices architecture serving 1M+ daily active users",
                "Improved application performance by 40% through code optimization and caching strategies",
                "Mentored 3 junior developers and established code review best practices",
                "Implemented CI/CD pipelines reducing deployment time from 2 hours to 15 minutes"
            ]
        },
        {
            "role": "Software Engineer",
            "organization": "StartupXYZ",
            "location": "Remote",
            "startDate": "2019-06",
            "endDate": "2021-02",
            "bullets": [
                "Built responsive React applications with TypeScript and Redux",
                "Developed RESTful APIs using Node.js and Express",
                "Collaborated with design team to implement pixel-perfect UI components",
                "Participated in agile development process with 2-week sprints"
            ]
        },
        {
            "role": "Junior Developer",
            "organization": "WebDev Solutions",
            "location": "Austin, TX",
            "startDate": "2018-01",
            "endDate": "2019-05",
            "bullets": [
                "Maintained legacy PHP applications and migrated to modern frameworks",
                "Created automated testing suites increasing code coverage to 85%",
                "Assisted in database design and optimization for e-commerce platform"
            ]
        }
    ],
    "skills": [
        "JavaScript",
        "TypeScript",
        "React",
        "Node.js",
        "Python",
        "AWS",
        "Docker",
        "PostgreSQL",
        "MongoDB",
        "Git",
        "Agile/Scrum",
        "RESTful APIs"
    ],
    "factsInventory": {
        "skills": [
            "JavaScript",
            "TypeScript",
            "React",
            "Node.js",
            "Python",
            "AWS",
            "Docker",
            "PostgreSQL",
            "MongoDB",
            "Git",
            "Agile/Scrum",
            "RESTful APIs"
        ],
        "organizations": [
            "TechCorp Inc.",
            "StartupXYZ",
            "WebDev Solutions"
        ],
        "roles": [
            "Senior Software Engineer",
            "Software Engineer",
            "Junior Developer"
        ],
        "dates": [
            {
                "start": "2021-03",
                "end": null
            },
            {
                "start": "2019-06",
                "end": "2021-02"
            },
            {
                "start": "2018-01",
                "end": "2019-05"
            }
        ],
        "certifications": [
            "AWS Certified Developer",
            "Google Cloud Professional Developer"
        ]
    }
}