{
    "title": "Software Engineer",
    "summary": "Results-driven software engineer with expertise in full-stack development, cloud technologies, and agile methodologies. Proven track record of delivering scalable solutions and leading cross-functional teams.",
    "experience": [
        {
            "role": "Software Engineer",
            "organization": "Technology Company",
            "location": "City, State",
            "startDate": "2020-01",
            "endDate": null,
            "bullets": [
                "Developed and maintained web applications using modern JavaScript frameworks",
                "Collaborated with cross-functional teams to deliver high-quality software solutions",
                "Implemented automated testing and continuous integration processes",
                "Optimized application performance and reduced load times by 30%"
            ]
        },
        {
            "role": "Junior Developer",
            "organization": "Software Solutions Inc",
            "location": "City, State",
            "startDate": "2018-06",
            "endDate": "2019-12",
            "bullets": [
                "Assisted in development of client-side applications using React and Redux",
                "Participated in code reviews and maintained high code quality standards",
                "Worked with backend APIs and database integration",
                "Contributed to documentation and technical specifications"
            ]
        }
    ],
    "skills": [
        "JavaScript",
        "Python",
        "React",
        "Node.js",
        "SQL",
        "Git",
        "Agile",
        "Problem Solving",
        "Team Collaboration",
        "Communication"
    ],
    "factsInventory": {
        "skills": [
            "JavaScript",
            "Python",
            "React",
            "Node.js",
            "SQL",
            "Git",
            "Agile",
            "Problem Solving",
            "Team Collaboration",
            "Communication"
        ],
        "organizations": [
            "Technology Company",
            "Software Solutions Inc"
        ],
        "roles": [
            "Software Engineer",
            "Junior Developer"
        ],
        "dates": [
            {
                "start": "2020-01",
                "end": null
            },
            {
                "start": "2018-06",
                "end": "2019-12"
            }
        ],
        "certifications": []
    }
}